{
  "schemaVersion": "tabellio-review-cycle/v0.2",
  "id": "review-example-001",
  "repository": { "id": "example/tabellio" },
  "provider": { "id": "github", "owner": "example", "repo": "tabellio" },
  "changeRequest": {
    "id": "7",
    "number": 7,
    "url": "https://github.com/example/tabellio/pull/7",
    "title": "Example agent change",
    "state": "open",
    "draft": false,
    "mergeable": true,
    "headBranch": "agent/example",
    "headCommit": "bbbbbbbbbbbbbbbbbbbbbbbbbbbbbbbbbbbbbbbb",
    "baseBranch": "main",
    "baseCommit": "aaaaaaaaaaaaaaaaaaaaaaaaaaaaaaaaaaaaaaaa",
    "updatedAt": "2026-07-10T12:00:00.000Z"
  },
  "status": "ready",
  "round": 1,
  "feedback": [],
  "fixes": [],
  "checks": {
    "commit": "bbbbbbbbbbbbbbbbbbbbbbbbbbbbbbbbbbbbbbbb",
    "state": "success",
    "total": 1,
    "statuses": [{
      "id": "51",
      "context": "tests",
      "state": "success",
      "description": "Checks passed",
      "targetUrl": "https://github.com/example/tabellio/actions/runs/51",
      "createdAt": "2026-07-10T12:00:00.000Z",
      "updatedAt": "2026-07-10T12:00:00.000Z"
    }]
  },
  "events": [
    {
      "id": "event-example-001",
      "type": "synced",
      "actor": "example-agent",
      "at": "2026-07-10T12:00:00.000Z",
      "detail": "Synced 0 feedback items at example head."
    },
    {
      "id": "event-example-002",
      "type": "ready",
      "actor": "example-agent",
      "at": "2026-07-10T12:00:00.000Z",
      "detail": "bbbbbbbbbbbbbbbbbbbbbbbbbbbbbbbbbbbbbbbb"
    }
  ],
  "createdAt": "2026-07-10T12:00:00.000Z",
  "updatedAt": "2026-07-10T12:00:00.000Z",
  "integrity": {
    "algorithm": "sha256",
    "digest": "0cd789f42ee49845ae468f299ef16b311728d16d091d44b8b68ed380c04f9651"
  }
}
